{
  "source": "cli",
  "timestamp": "2026-08-18T18:00:00.000Z",
  "repo": "fixtures/noisy-app",
  "team": "payments-platform",
  "provider": "generic",
  "findings": [
    {
      "path": "package-lock.json",
      "reason": "high_risk_filetype",
      "bytes": 802241,
      "estTokens": 200561,
      "action": "excluded",
      "source": "heuristic"
    },
    {
      "path": "AGENTS.md",
      "reason": "redundant_instructions",
      "bytes": 4200,
      "estTokens": 1050,
      "action": "excluded",
      "source": "llm",
      "confidence": 0.88,
      "detail": "Repeats lint and test guidance already present in README.md"
    }
  ],
  "totals": {
    "beforeTokens": 374411,
    "afterTokens": 65,
    "savedTokens": 374346
  },
  "scan": {
    "mode": "hybrid",
    "llm": {
      "backend": "ollama",
      "model": "qwen2.5-coder:7b",
      "endpoint": "http://127.0.0.1:11434",
      "durationMs": 842,
      "candidatesSent": 8
    }
  }
}
